{"$schema":"https://json-schema.org/draft/2020-12/schema","title":"AWA Asset Graph Node v0.1","description":"","type":"object","required":["contract","node_id","node_type","namespace","semantic_ref","version","status","metadata","provenance_ref"],"properties":{"contract":{"const":"asset-graph-node.v0.1"},"node_id":{"type":"string","minLength":1},"node_type":{"type":"string","enum":["semantic","fragment","artifact","module","validation","task"]},"namespace":{"type":"string","minLength":1},"semantic_ref":{"type":["string","null"]},"version":{"type":"string","pattern":"^v\\d+\\.\\d+$"},"status":{"type":"string","enum":["active","candidate","missing","superseded","deprecated","failed"]},"metadata":{"type":"object","additionalProperties":true},"provenance_ref":{"type":"string","minLength":1}},"additionalProperties":false,"$id":"urn:awa:schema:asset-graph-node-v0-1"}
