{
  "contract": "asset-graph-node.v0.1",
  "metadata": {
    "role": "facility"
  },
  "namespace": "game.relay_station",
  "node_id": "facility.storm_relay",
  "node_type": "semantic",
  "provenance_ref": "sedb://facility.storm_relay",
  "semantic_ref": "facility.storm_relay",
  "status": "active",
  "version": "v0.1"
}
